19:58:59.115720 IP 192.168.1.134.57802 > ec2-13-59-223-221.us-east-2.compute.amazonaws.com.https: Flags [P.], seq 3048695301:3048695336, ack 3330673866, win 2048, options [nop,nop,TS val 750564282 ecr 2988583442], length 35
19:58:59.151006 IP ec2-13-59-223-221.us-east-2.compute.amazonaws.com.https > 192.168.1.134.57802: Flags [.], ack 35, win 14, options [nop,nop,TS val 2988589485 ecr 750564282], length 0
19:58:59.240248 IP 192.168.1.134.60853 > ec2-34-194-201-2.compute-1.amazonaws.com.https: Flags [P.], seq 1682453573:1682453636, ack 661961127, win 2048, options [nop,nop,TS val 750564406 ecr 100470838], length 63
19:58:59.280978 IP ec2-34-194-201-2.compute-1.amazonaws.com.https > 192.168.1.134.60853: Flags [P.], seq 1:64, ack 63, win 12, options [nop,nop,TS val 100473372 ecr 750564406], length 63
19:58:59.281102 IP 192.168.1.134.60853 > ec2-34-194-201-2.compute-1.amazonaws.com.https: Flags [.], ack 64, win 2047, options [nop,nop,TS val 750564446 ecr 100473372], length 0
19:58:59.823355 STP 802.1d, Config, Flags [none], bridge-id 8000.2c:fd:a1:62:8f:80.8003, length 35
19:58:59.874607 IP 192.168.1.134.52542 > 173.194.162.199.https: UDP, length 737
19:58:59.888040 IP 173.194.162.199.https > 192.168.1.134.52542: UDP, length 121
19:58:59.888986 IP 173.194.162.199.https > 192.168.1.134.52542: UDP, length 1350
19:58:59.888989 IP 173.194.162.199.https > 192.168.1.134.52542: UDP, length 1350
19:58:59.888991 IP 173.194.162.199.https > 192.168.1.134.52542: UDP, length 1350
19:58:59.888992 IP 173.194.162.199.https > 192.168.1.134.52542: UDP, length 1350
19:58:59.888992 IP 173.194.162.199.https > 192.168.1.134.52542: UDP, length 1350
19:58:59.888995 IP 173.194.162.199.https > 192.168.1.134.52542: UDP, length 1350
19:58:59.888996 IP 173.194.162.199.https > 192.168.1.134.52542: UDP, length 1350
19:58:59.888997 IP 173.194.162.199.https > 192.168.1.134.52542: UDP, length 1350
19:58:59.888998 IP 173.194.162.199.https > 192.168.1.134.52542: UDP, length 1350
19:58:59.888999 IP 173.194.162.199.https > 192.168.1.134.52542: UDP, length 1350
19:58:59.889094 IP 173.194.162.199.https > 192.168.1.134.52542: UDP, length 1350
19:58:59.889097 IP 173.194.162.199.https > 192.168.1.134.52542: UDP, length 1350
19:58:59.889098 IP 173.194.162.199.https > 192.168.1.134.52542: UDP, length 1350
19:58:59.889099 IP 173.194.162.199.https > 192.168.1.134.52542: UDP, length 1350
19:58:59.889100 IP 173.194.162.199.https > 192.168.1.134.52542: UDP, length 1350
19:58:59.889101 IP 173.194.162.199.https > 192.168.1.134.52542: UDP, length 1350
19:58:59.889263 IP 192.168.1.134.52542 > 173.194.162.199.https: UDP, length 29
19:58:59.890782 IP 173.194.162.199.https > 192.168.1.134.52542: UDP, length 1350
19:58:59.890785 IP 173.194.162.199.https > 192.168.1.134.52542: UDP, length 1350
19:58:59.890786 IP 173.194.162.199.https > 192.168.1.134.52542: UDP, length 1350
19:58:59.890787 IP 173.194.162.199.https > 192.168.1.134.52542: UDP, length 1350
19:58:59.890788 IP 173.194.162.199.https > 192.168.1.134.52542: UDP, length 1350
19:58:59.890790 IP 173.194.162.199.https > 192.168.1.134.52542: UDP, length 1350
19:58:59.890791 IP 173.194.162.199.https > 192.168.1.134.52542: UDP, length 1350
19:58:59.890792 IP 173.194.162.199.https > 192.168.1.134.52542: UDP, length 1350
19:58:59.890793 IP 173.194.162.199.https > 192.168.1.134.52542: UDP, length 1350
19:58:59.890794 IP 173.194.162.199.https > 192.168.1.134.52542: UDP, length 1350
19:58:59.890795 IP 173.194.162.199.https > 192.168.1.134.52542: UDP, length 1350
19:58:59.890796 IP 173.194.162.199.https > 192.168.1.134.52542: UDP, length 1350
19:58:59.890797 IP 173.194.162.199.https > 192.168.1.134.52542: UDP, length 1350
19:58:59.890798 IP 173.194.162.199.https > 192.168.1.134.52542: UDP, length 1350
19:58:59.890799 IP 173.194.162.199.https > 192.168.1.134.52542: UDP, length 1350
19:58:59.890800 IP 173.194.162.199.https > 192.168.1.134.52542: UDP, length 1350
19:58:59.890801 IP 173.194.162.199.https > 192.168.1.134.52542: UDP, length 1350
19:58:59.890802 IP 173.194.162.199.https > 192.168.1.134.52542: UDP, length 1350
19:58:59.890803 IP 173.194.162.199.https > 192.168.1.134.52542: UDP, length 1350
19:58:59.890804 IP 173.194.162.199.https > 192.168.1.134.52542: UDP, length 1350
19:58:59.890805 IP 173.194.162.199.https > 192.168.1.134.52542: UDP, length 1350
19:58:59.890842 IP 173.194.162.199.https > 192.168.1.134.52542: UDP, length 1350
19:58:59.890843 IP 173.194.162.199.https > 192.168.1.134.52542: UDP, length 1350
19:58:59.890844 IP 173.194.162.199.https > 192.168.1.134.52542: UDP, length 1350
19:58:59.890845 IP 173.194.162.199.https > 192.168.1.134.52542: UDP, length 1350
19:58:59.890846 IP 173.194.162.199.https > 192.168.1.134.52542: UDP, length 1350
19:58:59.891001 IP 173.194.162.199.https > 192.168.1.134.52542: UDP, length 1350
19:58:59.891004 IP 173.194.162.199.https > 192.168.1.134.52542: UDP, length 1350
19:58:59.891005 IP 173.194.162.199.https > 192.168.1.134.52542: UDP, length 1350
19:58:59.891006 IP 173.194.162.199.https > 192.168.1.134.52542: UDP, length 1350
19:58:59.891007 IP 173.194.162.199.https > 192.168.1.134.52542: UDP, length 1350
19:58:59.891008 IP 173.194.162.199.https > 192.168.1.134.52542: UDP, length 1350
19:58:59.891009 IP 173.194.162.199.https > 192.168.1.134.52542: UDP, length 1350
19:58:59.891039 IP 173.194.162.199.https > 192.168.1.134.52542: UDP, length 1350
19:58:59.891041 IP 173.194.162.199.https > 192.168.1.134.52542: UDP, length 1350
19:58:59.891042 IP 173.194.162.199.https > 192.168.1.134.52542: UDP, length 1350
19:58:59.891051 IP 192.168.1.134.52542 > 173.194.162.199.https: UDP, length 29
19:58:59.891200 IP 173.194.162.199.https > 192.168.1.134.52542: UDP, length 1350
19:58:59.891203 IP 173.194.162.199.https > 192.168.1.134.52542: UDP, length 1350
19:58:59.891204 IP 173.194.162.199.https > 192.168.1.134.52542: UDP, length 1350
19:58:59.891205 IP 173.194.162.199.https > 192.168.1.134.52542: UDP, length 1350
19:58:59.891206 IP 173.194.162.199.https > 192.168.1.134.52542: UDP, length 1350
19:58:59.891207 IP 173.194.162.199.https > 192.168.1.134.52542: UDP, length 1350
19:58:59.891242 IP 173.194.162.199.https > 192.168.1.134.52542: UDP, length 1350
19:58:59.891243 IP 173.194.162.199.https > 192.168.1.134.52542: UDP, length 1350
19:58:59.891244 IP 173.194.162.199.https > 192.168.1.134.52542: UDP, length 1350
19:58:59.891252 IP 192.168.1.134.52542 > 173.194.162.199.https: UDP, length 29
19:58:59.891304 IP 192.168.1.134.52542 > 173.194.162.199.https: UDP, length 29
19:58:59.891364 IP 173.194.162.199.https > 192.168.1.134.52542: UDP, length 1350
19:58:59.891449 IP 192.168.1.134.52542 > 173.194.162.199.https: UDP, length 29
19:58:59.891771 IP 192.168.1.134.52542 > 173.194.162.199.https: UDP, length 29
19:58:59.892893 IP 173.194.162.199.https > 192.168.1.134.52542: UDP, length 1350
19:58:59.892896 IP 173.194.162.199.https > 192.168.1.134.52542: UDP, length 1350
19:58:59.892897 IP 173.194.162.199.https > 192.168.1.134.52542: UDP, length 1350
19:58:59.892898 IP 173.194.162.199.https > 192.168.1.134.52542: UDP, length 1350
19:58:59.892899 IP 173.194.162.199.https > 192.168.1.134.52542: UDP, length 1350
19:58:59.892902 IP 173.194.162.199.https > 192.168.1.134.52542: UDP, length 1350
19:58:59.892902 IP 173.194.162.199.https > 192.168.1.134.52542: UDP, length 1350
19:58:59.892904 IP 173.194.162.199.https > 192.168.1.134.52542: UDP, length 1350
19:58:59.892905 IP 173.194.162.199.https > 192.168.1.134.52542: UDP, length 1350
19:58:59.892906 IP 173.194.162.199.https > 192.168.1.134.52542: UDP, length 1350
19:58:59.892907 IP 173.194.162.199.https > 192.168.1.134.52542: UDP, length 1350
19:58:59.892938 IP 173.194.162.199.https > 192.168.1.134.52542: UDP, length 1350
19:58:59.892939 IP 173.194.162.199.https > 192.168.1.134.52542: UDP, length 1350
19:58:59.892940 IP 173.194.162.199.https > 192.168.1.134.52542: UDP, length 1350
19:58:59.892941 IP 173.194.162.199.https > 192.168.1.134.52542: UDP, length 1350
19:58:59.893037 IP 173.194.162.199.https > 192.168.1.134.52542: UDP, length 1350
19:58:59.893039 IP 173.194.162.199.https > 192.168.1.134.52542: UDP, length 1350
19:58:59.893040 IP 173.194.162.199.https > 192.168.1.134.52542: UDP, length 1350
19:58:59.893041 IP 173.194.162.199.https > 192.168.1.134.52542: UDP, length 1350
19:58:59.893042 IP 173.194.162.199.https > 192.168.1.134.52542: UDP, length 1350
19:58:59.893133 IP 192.168.1.134.52542 > 173.194.162.199.https: UDP, length 29
19:58:59.893207 IP 173.194.162.199.https > 192.168.1.134.52542: UDP, length 1350
19:58:59.893210 IP 173.194.162.199.https > 192.168.1.134.52542: UDP, length 1350
19:58:59.893211 IP 173.194.162.199.https > 192.168.1.134.52542: UDP, length 1350
19:58:59.893212 IP 173.194.162.199.https > 192.168.1.134.52542: UDP, length 1350
19:58:59.893213 IP 173.194.162.199.https > 192.168.1.134.52542: UDP, length 1350
19:58:59.893214 IP 173.194.162.199.https > 192.168.1.134.52542: UDP, length 1350
19:58:59.893215 IP 173.194.162.199.https > 192.168.1.134.52542: UDP, length 1350
19:58:59.893234 IP 192.168.1.134.52542 > 173.194.162.199.https: UDP, length 29
19:58:59.893274 IP 173.194.162.199.https > 192.168.1.134.52542: UDP, length 1350
19:58:59.893276 IP 173.194.162.199.https > 192.168.1.134.52542: UDP, length 1350
19:58:59.893277 IP 173.194.162.199.https > 192.168.1.134.52542: UDP, length 1350
19:58:59.893278 IP 173.194.162.199.https > 192.168.1.134.52542: UDP, length 1350
19:58:59.893279 IP 173.194.162.199.https > 192.168.1.134.52542: UDP, length 1350
19:58:59.893374 IP 192.168.1.134.52542 > 173.194.162.199.https: UDP, length 29
19:58:59.893416 IP 173.194.162.199.https > 192.168.1.134.52542: UDP, length 1350
19:58:59.893418 IP 173.194.162.199.https > 192.168.1.134.52542: UDP, length 1350
19:58:59.893419 IP 173.194.162.199.https > 192.168.1.134.52542: UDP, length 1350
19:58:59.893420 IP 173.194.162.199.https > 192.168.1.134.52542: UDP, length 1350
19:58:59.893421 IP 173.194.162.199.https > 192.168.1.134.52542: UDP, length 1350
19:58:59.893422 IP 173.194.162.199.https > 192.168.1.134.52542: UDP, length 1350
19:58:59.893423 IP 173.194.162.199.https > 192.168.1.134.52542: UDP, length 1350
19:58:59.893531 IP 173.194.162.199.https > 192.168.1.134.52542: UDP, length 1350
19:58:59.893534 IP 173.194.162.199.https > 192.168.1.134.52542: UDP, length 1350
19:58:59.893535 IP 173.194.162.199.https > 192.168.1.134.52542: UDP, length 1350
19:58:59.893536 IP 173.194.162.199.https > 192.168.1.134.52542: UDP, length 1350
19:58:59.893537 IP 173.194.162.199.https > 192.168.1.134.52542: UDP, length 1350
19:58:59.893540 IP 173.194.162.199.https > 192.168.1.134.52542: UDP, length 1350
19:58:59.893549 IP 192.168.1.134.52542 > 173.194.162.199.https: UDP, length 29
19:58:59.893683 IP 173.194.162.199.https > 192.168.1.134.52542: UDP, length 1350
19:58:59.893686 IP 173.194.162.199.https > 192.168.1.134.52542: UDP, length 1350
19:58:59.893792 IP 192.168.1.134.52542 > 173.194.162.199.https: UDP, length 29
19:58:59.894457 IP 173.194.162.199.https > 192.168.1.134.52542: UDP, length 1350
19:58:59.894459 IP 173.194.162.199.https > 192.168.1.134.52542: UDP, length 1350
19:58:59.894460 IP 173.194.162.199.https > 192.168.1.134.52542: UDP, length 1350
19:58:59.894462 IP 173.194.162.199.https > 192.168.1.134.52542: UDP, length 1350
19:58:59.894462 IP 173.194.162.199.https > 192.168.1.134.52542: UDP, length 1350
19:58:59.894465 IP 173.194.162.199.https > 192.168.1.134.52542: UDP, length 1350
19:58:59.894467 IP 173.194.162.199.https > 192.168.1.134.52542: UDP, length 1350
19:58:59.894468 IP 173.194.162.199.https > 192.168.1.134.52542: UDP, length 1350
19:58:59.894468 IP 173.194.162.199.https > 192.168.1.134.52542: UDP, length 1350
19:58:59.894470 IP 173.194.162.199.https > 192.168.1.134.52542: UDP, length 1350
19:58:59.894543 IP 173.194.162.199.https > 192.168.1.134.52542: UDP, length 1350
19:58:59.894545 IP 173.194.162.199.https > 192.168.1.134.52542: UDP, length 1350
19:58:59.894546 IP 173.194.162.199.https > 192.168.1.134.52542: UDP, length 1350
19:58:59.894546 IP 173.194.162.199.https > 192.168.1.134.52542: UDP, length 1350
19:58:59.894548 IP 173.194.162.199.https > 192.168.1.134.52542: UDP, length 1350
19:58:59.894637 IP 192.168.1.134.52542 > 173.194.162.199.https: UDP, length 29
19:58:59.894690 IP 173.194.162.199.https > 192.168.1.134.52542: UDP, length 1350
19:58:59.894692 IP 173.194.162.199.https > 192.168.1.134.52542: UDP, length 1350
19:58:59.894693 IP 173.194.162.199.https > 192.168.1.134.52542: UDP, length 1350
19:58:59.894694 IP 173.194.162.199.https > 192.168.1.134.52542: UDP, length 1350
19:58:59.894695 IP 173.194.162.199.https > 192.168.1.134.52542: UDP, length 1350
19:58:59.894696 IP 173.194.162.199.https > 192.168.1.134.52542: UDP, length 1350
19:58:59.894698 IP 173.194.162.199.https > 192.168.1.134.52542: UDP, length 1350
19:58:59.894728 IP 173.194.162.199.https > 192.168.1.134.52542: UDP, length 1350
19:58:59.894729 IP 173.194.162.199.https > 192.168.1.134.52542: UDP, length 1350
19:58:59.894730 IP 173.194.162.199.https > 192.168.1.134.52542: UDP, length 1350
19:58:59.894856 IP 192.168.1.134.52542 > 173.194.162.199.https: UDP, length 29
19:58:59.894911 IP 173.194.162.199.https > 192.168.1.134.52542: UDP, length 1350
19:58:59.894913 IP 173.194.162.199.https > 192.168.1.134.52542: UDP, length 1350
19:58:59.894914 IP 173.194.162.199.https > 192.168.1.134.52542: UDP, length 1350
19:58:59.894915 IP 173.194.162.199.https > 192.168.1.134.52542: UDP, length 1350
19:58:59.894916 IP 173.194.162.199.https > 192.168.1.134.52542: UDP, length 1350
19:58:59.894917 IP 173.194.162.199.https > 192.168.1.134.52542: UDP, length 1350
19:58:59.894918 IP 173.194.162.199.https > 192.168.1.134.52542: UDP, length 1350
19:58:59.894919 IP 173.194.162.199.https > 192.168.1.134.52542: UDP, length 1350
19:58:59.894920 IP 173.194.162.199.https > 192.168.1.134.52542: UDP, length 1350
19:58:59.894954 IP 173.194.162.199.https > 192.168.1.134.52542: UDP, length 1350
19:58:59.894957 IP 173.194.162.199.https > 192.168.1.134.52542: UDP, length 1350
19:58:59.894957 IP 173.194.162.199.https > 192.168.1.134.52542: UDP, length 1350
19:58:59.895133 IP 173.194.162.199.https > 192.168.1.134.52542: UDP, length 1350
19:58:59.895136 IP 173.194.162.199.https > 192.168.1.134.52542: UDP, length 1350
19:58:59.895139 IP 173.194.162.199.https > 192.168.1.134.52542: UDP, length 1350
19:58:59.895140 IP 173.194.162.199.https > 192.168.1.134.52542: UDP, length 1350
19:58:59.895141 IP 173.194.162.199.https > 192.168.1.134.52542: UDP, length 1350
19:58:59.895142 IP 173.194.162.199.https > 192.168.1.134.52542: UDP, length 1350
19:58:59.895144 IP 173.194.162.199.https > 192.168.1.134.52542: UDP, length 1350
19:58:59.895175 IP 192.168.1.134.52542 > 173.194.162.199.https: UDP, length 29
19:58:59.895259 IP 173.194.162.199.https > 192.168.1.134.52542: UDP, length 1350
19:58:59.895262 IP 173.194.162.199.https > 192.168.1.134.52542: UDP, length 1350
19:58:59.895264 IP 173.194.162.199.https > 192.168.1.134.52542: UDP, length 1350
19:58:59.895271 IP 192.168.1.134.52542 > 173.194.162.199.https: UDP, length 29
19:58:59.896064 IP 173.194.162.199.https > 192.168.1.134.52542: UDP, length 1350
19:58:59.896067 IP 173.194.162.199.https > 192.168.1.134.52542: UDP, length 1350
19:58:59.896068 IP 173.194.162.199.https > 192.168.1.134.52542: UDP, length 1350
19:58:59.896069 IP 173.194.162.199.https > 192.168.1.134.52542: UDP, length 1350
19:58:59.896070 IP 173.194.162.199.https > 192.168.1.134.52542: UDP, length 1350
19:58:59.896074 IP 173.194.162.199.https > 192.168.1.134.52542: UDP, length 1350
19:58:59.896075 IP 173.194.162.199.https > 192.168.1.134.52542: UDP, length 1350
19:58:59.896077 IP 173.194.162.199.https > 192.168.1.134.52542: UDP, length 1350
19:58:59.896078 IP 173.194.162.199.https > 192.168.1.134.52542: UDP, length 1350
19:58:59.896168 IP 173.194.162.199.https > 192.168.1.134.52542: UDP, length 1350
19:58:59.896171 IP 173.194.162.199.https > 192.168.1.134.52542: UDP, length 1350
19:58:59.896172 IP 173.194.162.199.https > 192.168.1.134.52542: UDP, length 1350
19:58:59.896174 IP 173.194.162.199.https > 192.168.1.134.52542: UDP, length 1350
19:58:59.896175 IP 173.194.162.199.https > 192.168.1.134.52542: UDP, length 1350
19:58:59.896183 IP 192.168.1.134.52542 > 173.194.162.199.https: UDP, length 29
19:58:59.896296 IP 173.194.162.199.https > 192.168.1.134.52542: UDP, length 1350
19:58:59.896299 IP 173.194.162.199.https > 192.168.1.134.52542: UDP, length 1350
19:58:59.896300 IP 173.194.162.199.https > 192.168.1.134.52542: UDP, length 1350
19:58:59.896301 IP 173.194.162.199.https > 192.168.1.134.52542: UDP, length 1350
19:58:59.896302 IP 173.194.162.199.https > 192.168.1.134.52542: UDP, length 1350
19:58:59.896304 IP 173.194.162.199.https > 192.168.1.134.52542: UDP, length 1350
19:58:59.896304 IP 173.194.162.199.https > 192.168.1.134.52542: UDP, length 1350
19:58:59.896322 IP 192.168.1.134.52542 > 173.194.162.199.https: UDP, length 29
19:58:59.896382 IP 173.194.162.199.https > 192.168.1.134.52542: UDP, length 1350
19:58:59.896385 IP 173.194.162.199.https > 192.168.1.134.52542: UDP, length 1350
19:58:59.896386 IP 173.194.162.199.https > 192.168.1.134.52542: UDP, length 1350
19:58:59.896387 IP 173.194.162.199.https > 192.168.1.134.52542: UDP, length 1350
19:58:59.896447 IP 192.168.1.134.52542 > 173.194.162.199.https: UDP, length 29
19:58:59.896506 IP 173.194.162.199.https > 192.168.1.134.52542: UDP, length 1350
19:58:59.896509 IP 173.194.162.199.https > 192.168.1.134.52542: UDP, length 1350
19:58:59.896510 IP 173.194.162.199.https > 192.168.1.134.52542: UDP, length 1350
19:58:59.896511 IP 173.194.162.199.https > 192.168.1.134.52542: UDP, length 1350
19:58:59.896512 IP 173.194.162.199.https > 192.168.1.134.52542: UDP, length 1350
19:58:59.896513 IP 173.194.162.199.https > 192.168.1.134.52542: UDP, length 1350
19:58:59.896638 IP 173.194.162.199.https > 192.168.1.134.52542: UDP, length 1350
19:58:59.896641 IP 173.194.162.199.https > 192.168.1.134.52542: UDP, length 1350
19:58:59.896755 IP 192.168.1.134.52542 > 173.194.162.199.https: UDP, length 29
19:58:59.896833 IP 173.194.162.199.https > 192.168.1.134.52542: UDP, length 1350
19:58:59.896836 IP 173.194.162.199.https > 192.168.1.134.52542: UDP, length 1350
19:58:59.896837 IP 173.194.162.199.https > 192.168.1.134.52542: UDP, length 1350
19:58:59.896838 IP 173.194.162.199.https > 192.168.1.134.52542: UDP, length 1350
19:58:59.896839 IP 173.194.162.199.https > 192.168.1.134.52542: UDP, length 1350
19:58:59.896842 IP 173.194.162.199.https > 192.168.1.134.52542: UDP, length 1350
19:58:59.896902 IP 173.194.162.199.https > 192.168.1.134.52542: UDP, length 1350
19:58:59.896904 IP 173.194.162.199.https > 192.168.1.134.52542: UDP, length 1350
19:58:59.897045 IP 173.194.162.199.https > 192.168.1.134.52542: UDP, length 1350
19:58:59.897049 IP 173.194.162.199.https > 192.168.1.134.52542: UDP, length 1350
19:58:59.897050 IP 173.194.162.199.https > 192.168.1.134.52542: UDP, length 1350
19:58:59.897050 IP 173.194.162.199.https > 192.168.1.134.52542: UDP, length 1350
19:58:59.897052 IP 173.194.162.199.https > 192.168.1.134.52542: UDP, length 1350
19:58:59.897053 IP 173.194.162.199.https > 192.168.1.134.52542: UDP, length 1350
19:58:59.897053 IP 173.194.162.199.https > 192.168.1.134.52542: UDP, length 1350
19:58:59.897124 IP 173.194.162.199.https > 192.168.1.134.52542: UDP, length 1350
19:58:59.897126 IP 173.194.162.199.https > 192.168.1.134.52542: UDP, length 1350
19:58:59.897128 IP 173.194.162.199.https > 192.168.1.134.52542: UDP, length 1350
19:58:59.897129 IP 173.194.162.199.https > 192.168.1.134.52542: UDP, length 1350
19:58:59.897195 IP 192.168.1.134.52542 > 173.194.162.199.https: UDP, length 42
19:58:59.897260 IP 173.194.162.199.https > 192.168.1.134.52542: UDP, length 1350
19:58:59.897263 IP 173.194.162.199.https > 192.168.1.134.52542: UDP, length 1350
19:58:59.897370 IP 192.168.1.134.52542 > 173.194.162.199.https: UDP, length 29
19:58:59.897428 IP 173.194.162.199.https > 192.168.1.134.52542: UDP, length 1350
19:58:59.897430 IP 173.194.162.199.https > 192.168.1.134.52542: UDP, length 1350
19:58:59.897431 IP 173.194.162.199.https > 192.168.1.134.52542: UDP, length 1350
19:58:59.897433 IP 173.194.162.199.https > 192.168.1.134.52542: UDP, length 1350
19:58:59.897434 IP 173.194.162.199.https > 192.168.1.134.52542: UDP, length 1350
19:58:59.897436 IP 173.194.162.199.https > 192.168.1.134.52542: UDP, length 1350
19:58:59.897438 IP 173.194.162.199.https > 192.168.1.134.52542: UDP, length 1350
19:58:59.897576 IP 173.194.162.199.https > 192.168.1.134.52542: UDP, length 1350
19:58:59.897580 IP 173.194.162.199.https > 192.168.1.134.52542: UDP, length 1350
19:58:59.897581 IP 173.194.162.199.https > 192.168.1.134.52542: UDP, length 1350
19:58:59.897714 IP 173.194.162.199.https > 192.168.1.134.52542: UDP, length 1350
19:58:59.897726 IP 192.168.1.134.52542 > 173.194.162.199.https: UDP, length 29
19:58:59.897863 IP 173.194.162.199.https > 192.168.1.134.52542: UDP, length 1350
19:58:59.897866 IP 173.194.162.199.https > 192.168.1.134.52542: UDP, length 1350
19:58:59.898049 IP 173.194.162.199.https > 192.168.1.134.52542: UDP, length 1350
19:58:59.899409 IP 173.194.162.199.https > 192.168.1.134.52542: UDP, length 1350
19:58:59.900099 IP 173.194.162.199.https > 192.168.1.134.52542: UDP, length 1350
19:58:59.900102 IP 173.194.162.199.https > 192.168.1.134.52542: UDP, length 1350
19:58:59.900104 IP 173.194.162.199.https > 192.168.1.134.52542: UDP, length 1350
19:58:59.900105 IP 173.194.162.199.https > 192.168.1.134.52542: UDP, length 1350
19:58:59.900107 IP 173.194.162.199.https > 192.168.1.134.52542: UDP, length 1350
19:58:59.900108 IP 173.194.162.199.https > 192.168.1.134.52542: UDP, length 1350
19:58:59.900109 IP 173.194.162.199.https > 192.168.1.134.52542: UDP, length 1350
19:58:59.900110 IP 173.194.162.199.https > 192.168.1.134.52542: UDP, length 1350
19:58:59.900111 IP 173.194.162.199.https > 192.168.1.134.52542: UDP, length 1350
19:58:59.900115 IP 173.194.162.199.https > 192.168.1.134.52542: UDP, length 1350
19:58:59.900145 IP 173.194.162.199.https > 192.168.1.134.52542: UDP, length 1350
19:58:59.900147 IP 173.194.162.199.https > 192.168.1.134.52542: UDP, length 1350
19:58:59.900148 IP 173.194.162.199.https > 192.168.1.134.52542: UDP, length 1350
19:58:59.900149 IP 173.194.162.199.https > 192.168.1.134.52542: UDP, length 1350
19:58:59.900281 IP 173.194.162.199.https > 192.168.1.134.52542: UDP, length 1350
19:58:59.900284 IP 173.194.162.199.https > 192.168.1.134.52542: UDP, length 1350
19:58:59.900285 IP 173.194.162.199.https > 192.168.1.134.52542: UDP, length 1350
19:58:59.900287 IP 173.194.162.199.https > 192.168.1.134.52542: UDP, length 1350
19:58:59.900287 IP 173.194.162.199.https > 192.168.1.134.52542: UDP, length 1350
19:58:59.900289 IP 173.194.162.199.https > 192.168.1.134.52542: UDP, length 1350
19:58:59.900298 IP 192.168.1.134.52542 > 173.194.162.199.https: UDP, length 29
19:58:59.900390 IP 173.194.162.199.https > 192.168.1.134.52542: UDP, length 1350
19:58:59.900393 IP 173.194.162.199.https > 192.168.1.134.52542: UDP, length 1350
19:58:59.900394 IP 173.194.162.199.https > 192.168.1.134.52542: UDP, length 1350
19:58:59.900395 IP 173.194.162.199.https > 192.168.1.134.52542: UDP, length 1350
19:58:59.900396 IP 173.194.162.199.https > 192.168.1.134.52542: UDP, length 1350
19:58:59.900397 IP 173.194.162.199.https > 192.168.1.134.52542: UDP, length 1350
19:58:59.900403 IP 192.168.1.134.52542 > 173.194.162.199.https: UDP, length 29
19:58:59.900476 IP 173.194.162.199.https > 192.168.1.134.52542: UDP, length 1350
19:58:59.900478 IP 173.194.162.199.https > 192.168.1.134.52542: UDP, length 1350
19:58:59.900479 IP 173.194.162.199.https > 192.168.1.134.52542: UDP, length 1350
19:58:59.900480 IP 173.194.162.199.https > 192.168.1.134.52542: UDP, length 1350
19:58:59.900481 IP 173.194.162.199.https > 192.168.1.134.52542: UDP, length 1350
19:58:59.900488 IP 192.168.1.134.52542 > 173.194.162.199.https: UDP, length 29
19:58:59.900622 IP 173.194.162.199.https > 192.168.1.134.52542: UDP, length 1350
19:58:59.900786 IP 173.194.162.199.https > 192.168.1.134.52542: UDP, length 1350
19:58:59.900788 IP 173.194.162.199.https > 192.168.1.134.52542: UDP, length 1350
19:58:59.900789 IP 173.194.162.199.https > 192.168.1.134.52542: UDP, length 1350
19:58:59.900791 IP 173.194.162.199.https > 192.168.1.134.52542: UDP, length 1350
19:58:59.900792 IP 173.194.162.199.https > 192.168.1.134.52542: UDP, length 1350
19:58:59.900793 IP 173.194.162.199.https > 192.168.1.134.52542: UDP, length 1350
19:58:59.900794 IP 173.194.162.199.https > 192.168.1.134.52542: UDP, length 1350
19:58:59.900873 IP 192.168.1.134.52542 > 173.194.162.199.https: UDP, length 30
19:58:59.900920 IP 173.194.162.199.https > 192.168.1.134.52542: UDP, length 1350
19:58:59.900922 IP 173.194.162.199.https > 192.168.1.134.52542: UDP, length 1350
19:58:59.900923 IP 173.194.162.199.https > 192.168.1.134.52542: UDP, length 1350
19:58:59.901014 IP 173.194.162.199.https > 192.168.1.134.52542: UDP, length 1350
19:58:59.901016 IP 173.194.162.199.https > 192.168.1.134.52542: UDP, length 1350
19:58:59.901017 IP 173.194.162.199.https > 192.168.1.134.52542: UDP, length 1350
19:58:59.901019 IP 173.194.162.199.https > 192.168.1.134.52542: UDP, length 1350
19:58:59.901020 IP 173.194.162.199.https > 192.168.1.134.52542: UDP, length 1350
19:58:59.901102 IP 173.194.162.199.https > 192.168.1.134.52542: UDP, length 1350
19:58:59.901105 IP 173.194.162.199.https > 192.168.1.134.52542: UDP, length 1350
19:58:59.901106 IP 173.194.162.199.https > 192.168.1.134.52542: UDP, length 1350
19:58:59.901107 IP 173.194.162.199.https > 192.168.1.134.52542: UDP, length 1350
19:58:59.901114 IP 192.168.1.134.52542 > 173.194.162.199.https: UDP, length 30
19:58:59.901259 IP 173.194.162.199.https > 192.168.1.134.52542: UDP, length 1350
19:58:59.901261 IP 173.194.162.199.https > 192.168.1.134.52542: UDP, length 1350
19:58:59.901262 IP 173.194.162.199.https > 192.168.1.134.52542: UDP, length 1350
19:58:59.901386 IP 173.194.162.199.https > 192.168.1.134.52542: UDP, length 1350
19:58:59.901388 IP 173.194.162.199.https > 192.168.1.134.52542: UDP, length 1350
19:58:59.901388 IP 173.194.162.199.https > 192.168.1.134.52542: UDP, length 1350
19:58:59.901390 IP 173.194.162.199.https > 192.168.1.134.52542: UDP, length 1350
19:58:59.901392 IP 173.194.162.199.https > 192.168.1.134.52542: UDP, length 1350
19:58:59.901399 IP 192.168.1.134.52542 > 173.194.162.199.https: UDP, length 30
19:58:59.901567 IP 173.194.162.199.https > 192.168.1.134.52542: UDP, length 1350
19:58:59.901569 IP 173.194.162.199.https > 192.168.1.134.52542: UDP, length 1350
19:58:59.901847 IP 173.194.162.199.https > 192.168.1.134.52542: UDP, length 1350
19:58:59.901848 IP 173.194.162.199.https > 192.168.1.134.52542: UDP, length 1350
19:58:59.901850 IP 173.194.162.199.https > 192.168.1.134.52542: UDP, length 1350
19:58:59.901851 IP 173.194.162.199.https > 192.168.1.134.52542: UDP, length 1350
19:58:59.901853 IP 173.194.162.199.https > 192.168.1.134.52542: UDP, length 1350
19:58:59.901934 IP 192.168.1.134.52542 > 173.194.162.199.https: UDP, length 30
19:58:59.901975 IP 173.194.162.199.https > 192.168.1.134.52542: UDP, length 1350
19:58:59.901978 IP 173.194.162.199.https > 192.168.1.134.52542: UDP, length 1350
19:58:59.902138 IP 173.194.162.199.https > 192.168.1.134.52542: UDP, length 1350
19:58:59.902140 IP 173.194.162.199.https > 192.168.1.134.52542: UDP, length 1350
19:58:59.903723 IP 173.194.162.199.https > 192.168.1.134.52542: UDP, length 1350
19:58:59.903726 IP 173.194.162.199.https > 192.168.1.134.52542: UDP, length 1350
19:58:59.903726 IP 173.194.162.199.https > 192.168.1.134.52542: UDP, length 1350
19:58:59.903727 IP 173.194.162.199.https > 192.168.1.134.52542: UDP, length 1350
19:58:59.903729 IP 173.194.162.199.https > 192.168.1.134.52542: UDP, length 1350
19:58:59.903731 IP 173.194.162.199.https > 192.168.1.134.52542: UDP, length 1350
19:58:59.903731 IP 173.194.162.199.https > 192.168.1.134.52542: UDP, length 1350
19:58:59.903732 IP 173.194.162.199.https > 192.168.1.134.52542: UDP, length 1350
19:58:59.903733 IP 173.194.162.199.https > 192.168.1.134.52542: UDP, length 1350
19:58:59.903808 IP 173.194.162.199.https > 192.168.1.134.52542: UDP, length 1350
19:58:59.903810 IP 173.194.162.199.https > 192.168.1.134.52542: UDP, length 1350
19:58:59.903811 IP 173.194.162.199.https > 192.168.1.134.52542: UDP, length 1350
19:58:59.903812 IP 173.194.162.199.https > 192.168.1.134.52542: UDP, length 1350
19:58:59.903814 IP 173.194.162.199.https > 192.168.1.134.52542: UDP, length 1350
19:58:59.903830 IP 192.168.1.134.52542 > 173.194.162.199.https: UDP, length 30
19:58:59.903911 IP 173.194.162.199.https > 192.168.1.134.52542: UDP, length 1350
19:58:59.903913 IP 173.194.162.199.https > 192.168.1.134.52542: UDP, length 1350
19:58:59.903914 IP 173.194.162.199.https > 192.168.1.134.52542: UDP, length 1350
19:58:59.903915 IP 173.194.162.199.https > 192.168.1.134.52542: UDP, length 1350
19:58:59.903916 IP 173.194.162.199.https > 192.168.1.134.52542: UDP, length 1350
19:58:59.903922 IP 192.168.1.134.52542 > 173.194.162.199.https: UDP, length 30
19:58:59.904065 IP 173.194.162.199.https > 192.168.1.134.52542: UDP, length 1350
19:58:59.904068 IP 173.194.162.199.https > 192.168.1.134.52542: UDP, length 1350
19:58:59.904070 IP 173.194.162.199.https > 192.168.1.134.52542: UDP, length 1350
19:58:59.904225 IP 173.194.162.199.https > 192.168.1.134.52542: UDP, length 1350
19:58:59.904227 IP 173.194.162.199.https > 192.168.1.134.52542: UDP, length 1350
19:58:59.904229 IP 173.194.162.199.https > 192.168.1.134.52542: UDP, length 1350
19:58:59.904230 IP 173.194.162.199.https > 192.168.1.134.52542: UDP, length 1350
19:58:59.904231 IP 173.194.162.199.https > 192.168.1.134.52542: UDP, length 1350
19:58:59.904232 IP 173.194.162.199.https > 192.168.1.134.52542: UDP, length 1350
19:58:59.904233 IP 173.194.162.199.https > 192.168.1.134.52542: UDP, length 1350
19:58:59.904286 IP 192.168.1.134.52542 > 173.194.162.199.https: UDP, length 30
19:58:59.904334 IP 173.194.162.199.https > 192.168.1.134.52542: UDP, length 1350
19:58:59.904337 IP 173.194.162.199.https > 192.168.1.134.52542: UDP, length 1350
19:58:59.904338 IP 173.194.162.199.https > 192.168.1.134.52542: UDP, length 1350
19:58:59.904339 IP 173.194.162.199.https > 192.168.1.134.52542: UDP, length 1350
19:58:59.904341 IP 173.194.162.199.https > 192.168.1.134.52542: UDP, length 1350
19:58:59.904407 IP 192.168.1.134.52542 > 173.194.162.199.https: UDP, length 30
19:58:59.904461 IP 173.194.162.199.https > 192.168.1.134.52542: UDP, length 1350
19:58:59.904463 IP 173.194.162.199.https > 192.168.1.134.52542: UDP, length 1350
19:58:59.904628 IP 173.194.162.199.https > 192.168.1.134.52542: UDP, length 1350
19:58:59.904630 IP 173.194.162.199.https > 192.168.1.134.52542: UDP, length 1350
19:58:59.904631 IP 173.194.162.199.https > 192.168.1.134.52542: UDP, length 1350
19:58:59.904633 IP 173.194.162.199.https > 192.168.1.134.52542: UDP, length 1350
19:58:59.904633 IP 173.194.162.199.https > 192.168.1.134.52542: UDP, length 1350
19:58:59.904634 IP 173.194.162.199.https > 192.168.1.134.52542: UDP, length 1350
19:58:59.904730 IP 173.194.162.199.https > 192.168.1.134.52542: UDP, length 1350
19:58:59.904732 IP 173.194.162.199.https > 192.168.1.134.52542: UDP, length 1350
19:58:59.904869 IP 173.194.162.199.https > 192.168.1.134.52542: UDP, length 1350
19:58:59.904873 IP 173.194.162.199.https > 192.168.1.134.52542: UDP, length 1350
19:58:59.904886 IP 192.168.1.134.52542 > 173.194.162.199.https: UDP, length 30
19:58:59.905036 IP 173.194.162.199.https > 192.168.1.134.52542: UDP, length 1350
19:58:59.905043 IP 173.194.162.199.https > 192.168.1.134.52542: UDP, length 1350
19:58:59.905044 IP 173.194.162.199.https > 192.168.1.134.52542: UDP, length 1350
19:58:59.905212 IP 173.194.162.199.https > 192.168.1.134.52542: UDP, length 1350
19:58:59.905214 IP 173.194.162.199.https > 192.168.1.134.52542: UDP, length 1350
19:58:59.905214 IP 173.194.162.199.https > 192.168.1.134.52542: UDP, length 1350
19:58:59.905368 IP 173.194.162.199.https > 192.168.1.134.52542: UDP, length 1350
19:58:59.905370 IP 173.194.162.199.https > 192.168.1.134.52542: UDP, length 1350
19:58:59.905371 IP 173.194.162.199.https > 192.168.1.134.52542: UDP, length 1350
19:58:59.905432 IP 192.168.1.134.52542 > 173.194.162.199.https: UDP, length 30
19:58:59.905581 IP 173.194.162.199.https > 192.168.1.134.52542: UDP, length 1350
19:58:59.905584 IP 173.194.162.199.https > 192.168.1.134.52542: UDP, length 1350
19:58:59.905585 IP 173.194.162.199.https > 192.168.1.134.52542: UDP, length 1350
19:58:59.905945 IP 173.194.162.199.https > 192.168.1.134.52542: UDP, length 1350
19:58:59.905948 IP 173.194.162.199.https > 192.168.1.134.52542: UDP, length 1350
19:58:59.905949 IP 173.194.162.199.https > 192.168.1.134.52542: UDP, length 1350
19:58:59.905950 IP 173.194.162.199.https > 192.168.1.134.52542: UDP, length 1350
19:58:59.906117 IP 173.194.162.199.https > 192.168.1.134.52542: UDP, length 1350
19:58:59.906119 IP 173.194.162.199.https > 192.168.1.134.52542: UDP, length 1350
19:58:59.906120 IP 173.194.162.199.https > 192.168.1.134.52542: UDP, length 1350
19:58:59.906121 IP 173.194.162.199.https > 192.168.1.134.52542: UDP, length 1350
19:58:59.906183 IP 192.168.1.134.52542 > 173.194.162.199.https: UDP, length 30
19:58:59.906310 IP 173.194.162.199.https > 192.168.1.134.52542: UDP, length 1350
19:58:59.906313 IP 173.194.162.199.https > 192.168.1.134.52542: UDP, length 1350
19:58:59.906314 IP 173.194.162.199.https > 192.168.1.134.52542: UDP, length 1350
19:58:59.906315 IP 173.194.162.199.https > 192.168.1.134.52542: UDP, length 1350
19:58:59.906496 IP 173.194.162.199.https > 192.168.1.134.52542: UDP, length 1350
19:58:59.906498 IP 173.194.162.199.https > 192.168.1.134.52542: UDP, length 1350
19:58:59.906499 IP 173.194.162.199.https > 192.168.1.134.52542: UDP, length 1350
19:58:59.906645 IP 173.194.162.199.https > 192.168.1.134.52542: UDP, length 1350
19:58:59.906647 IP 173.194.162.199.https > 192.168.1.134.52542: UDP, length 1350
19:58:59.906649 IP 173.194.162.199.https > 192.168.1.134.52542: UDP, length 1350
19:58:59.906707 IP 192.168.1.134.52542 > 173.194.162.199.https: UDP, length 30
19:58:59.906811 IP 173.194.162.199.https > 192.168.1.134.52542: UDP, length 1350
19:58:59.906814 IP 173.194.162.199.https > 192.168.1.134.52542: UDP, length 1350
19:58:59.906815 IP 173.194.162.199.https > 192.168.1.134.52542: UDP, length 1350
19:58:59.906998 IP 173.194.162.199.https > 192.168.1.134.52542: UDP, length 1350
19:58:59.907000 IP 173.194.162.199.https > 192.168.1.134.52542: UDP, length 1350
19:58:59.907001 IP 173.194.162.199.https > 192.168.1.134.52542: UDP, length 1350
19:58:59.907002 IP 173.194.162.199.https > 192.168.1.134.52542: UDP, length 1350
19:58:59.907162 IP 173.194.162.199.https > 192.168.1.134.52542: UDP, length 1350
19:58:59.907221 IP 192.168.1.134.52542 > 173.194.162.199.https: UDP, length 30
19:58:59.907809 IP 192.168.1.134.49646 > dns.google.domain: 4608+ PTR? 134.1.168.192.in-addr.arpa. (44)
19:58:59.909576 IP 173.194.162.199.https > 192.168.1.134.52542: UDP, length 1350
19:58:59.909578 IP 173.194.162.199.https > 192.168.1.134.52542: UDP, length 1350
19:58:59.909579 IP 173.194.162.199.https > 192.168.1.134.52542: UDP, length 1350
19:58:59.909581 IP 173.194.162.199.https > 192.168.1.134.52542: UDP, length 1350
19:58:59.909581 IP 173.194.162.199.https > 192.168.1.134.52542: UDP, length 1350
19:58:59.909582 IP 173.194.162.199.https > 192.168.1.134.52542: UDP, length 1350
19:58:59.909583 IP 173.194.162.199.https > 192.168.1.134.52542: UDP, length 1350
19:58:59.909587 IP 173.194.162.199.https > 192.168.1.134.52542: UDP, length 1350
19:58:59.909587 IP 173.194.162.199.https > 192.168.1.134.52542: UDP, length 1350
19:58:59.909589 IP 173.194.162.199.https > 192.168.1.134.52542: UDP, length 1350
19:58:59.909646 IP 173.194.162.199.https > 192.168.1.134.52542: UDP, length 1350
19:58:59.909648 IP 173.194.162.199.https > 192.168.1.134.52542: UDP, length 1350
19:58:59.909649 IP 173.194.162.199.https > 192.168.1.134.52542: UDP, length 1350
19:58:59.909650 IP 173.194.162.199.https > 192.168.1.134.52542: UDP, length 1350
19:58:59.909706 IP 192.168.1.134.52542 > 173.194.162.199.https: UDP, length 30
19:58:59.909763 IP 173.194.162.199.https > 192.168.1.134.52542: UDP, length 1350
19:58:59.909765 IP 173.194.162.199.https > 192.168.1.134.52542: UDP, length 1350
19:58:59.909766 IP 173.194.162.199.https > 192.168.1.134.52542: UDP, length 1350
19:58:59.909767 IP 173.194.162.199.https > 192.168.1.134.52542: UDP, length 1350
19:58:59.909768 IP 173.194.162.199.https > 192.168.1.134.52542: UDP, length 1350
19:58:59.909769 IP 173.194.162.199.https > 192.168.1.134.52542: UDP, length 1350
19:58:59.909890 IP 173.194.162.199.https > 192.168.1.134.52542: UDP, length 1350
19:58:59.909893 IP 173.194.162.199.https > 192.168.1.134.52542: UDP, length 1350
19:58:59.909894 IP 173.194.162.199.https > 192.168.1.134.52542: UDP, length 1350
19:58:59.909896 IP 173.194.162.199.https > 192.168.1.134.52542: UDP, length 1350
19:58:59.909897 IP 173.194.162.199.https > 192.168.1.134.52542: UDP, length 1350
19:58:59.909898 IP 173.194.162.199.https > 192.168.1.134.52542: UDP, length 1350
19:58:59.909904 IP 192.168.1.134.52542 > 173.194.162.199.https: UDP, length 43
19:58:59.910001 IP 173.194.162.199.https > 192.168.1.134.52542: UDP, length 1350
19:58:59.910003 IP 173.194.162.199.https > 192.168.1.134.52542: UDP, length 1350
19:58:59.910004 IP 173.194.162.199.https > 192.168.1.134.52542: UDP, length 1350
19:58:59.910006 IP 173.194.162.199.https > 192.168.1.134.52542: UDP, length 1350
19:58:59.910007 IP 173.194.162.199.https > 192.168.1.134.52542: UDP, length 1350
19:58:59.910007 IP 173.194.162.199.https > 192.168.1.134.52542: UDP, length 1350
19:58:59.910125 IP 173.194.162.199.https > 192.168.1.134.52542: UDP, length 1350
19:58:59.910127 IP 173.194.162.199.https > 192.168.1.134.52542: UDP, length 1350
19:58:59.910128 IP 173.194.162.199.https > 192.168.1.134.52542: UDP, length 1350
19:58:59.910129 IP 173.194.162.199.https > 192.168.1.134.52542: UDP, length 1350
19:58:59.910130 IP 173.194.162.199.https > 192.168.1.134.52542: UDP, length 1350
19:58:59.910136 IP 192.168.1.134.52542 > 173.194.162.199.https: UDP, length 30
19:58:59.910265 IP 173.194.162.199.https > 192.168.1.134.52542: UDP, length 1350
19:58:59.910267 IP 173.194.162.199.https > 192.168.1.134.52542: UDP, length 1350
19:58:59.910500 IP 173.194.162.199.https > 192.168.1.134.52542: UDP, length 1350
19:58:59.910503 IP 173.194.162.199.https > 192.168.1.134.52542: UDP, length 1350
19:58:59.910504 IP 173.194.162.199.https > 192.168.1.134.52542: UDP, length 1350
19:58:59.910505 IP 173.194.162.199.https > 192.168.1.134.52542: UDP, length 1350
19:58:59.910507 IP 173.194.162.199.https > 192.168.1.134.52542: UDP, length 1350
19:58:59.910508 IP 173.194.162.199.https > 192.168.1.134.52542: UDP, length 1350
19:58:59.910508 IP 173.194.162.199.https > 192.168.1.134.52542: UDP, length 1350
19:58:59.910590 IP 192.168.1.134.52542 > 173.194.162.199.https: UDP, length 30
19:58:59.910646 IP 173.194.162.199.https > 192.168.1.134.52542: UDP, length 1350
19:58:59.910648 IP 173.194.162.199.https > 192.168.1.134.52542: UDP, length 1350
19:58:59.910787 IP 173.194.162.199.https > 192.168.1.134.52542: UDP, length 1350
19:58:59.910790 IP 173.194.162.199.https > 192.168.1.134.52542: UDP, length 1350
19:58:59.910791 IP 173.194.162.199.https > 192.168.1.134.52542: UDP, length 1350
19:58:59.910792 IP 173.194.162.199.https > 192.168.1.134.52542: UDP, length 1350
19:58:59.910793 IP 173.194.162.199.https > 192.168.1.134.52542: UDP, length 1350
19:58:59.910795 IP 173.194.162.199.https > 192.168.1.134.52542: UDP, length 1350
19:58:59.910796 IP 173.194.162.199.https > 192.168.1.134.52542: UDP, length 1350
19:58:59.910889 IP 173.194.162.199.https > 192.168.1.134.52542: UDP, length 1350
19:58:59.910891 IP 173.194.162.199.https > 192.168.1.134.52542: UDP, length 1350
